{
  "$schema": "https://json-schema.org/draft/2020-12/schema",
  "$id": "https://github.com/lbailey94/continuity-receipt/schema/continuity-receipt-0.3.schema.json",
  "title": "Continuity Receipt bundle (continuity-receipt/0.1, /0.2 and /0.3)",
  "type": "object",
  "required": ["spec", "task_id", "receipts"],
  "properties": {
    "spec": { "enum": ["continuity-receipt/0.1", "continuity-receipt/0.2", "continuity-receipt/0.3"] },
    "task_id": { "$ref": "#/$defs/urn" },
    "receipts": {
      "type": "array",
      "minItems": 1,
      "items": { "$ref": "#/$defs/receipt" }
    },
    "disclosure_map": {
      "type": "object",
      "additionalProperties": { "type": "object" }
    },
    "anchors": {
      "type": "array",
      "items": { "$ref": "#/$defs/anchor" }
    },
    "revocations": {
      "type": "array",
      "items": { "$ref": "#/$defs/revocation" }
    }
  },
  "additionalProperties": true,
  "$defs": {
    "urn": { "type": "string", "pattern": "^urn:uuid:[0-9a-fA-F-]{36}$" },
    "hash": { "type": "string", "pattern": "^sha256:[0-9a-f]{64}$" },
    "timestamp": {
      "type": "string",
      "pattern": "^\\d{4}-\\d{2}-\\d{2}T\\d{2}:\\d{2}:\\d{2}(\\.\\d{1,3})?Z$"
    },
    "redaction": {
      "type": "object",
      "required": ["redacted", "commit"],
      "properties": {
        "redacted": { "const": true },
        "commit": { "$ref": "#/$defs/hash" },
        "erased": { "type": "boolean" }
      },
      "additionalProperties": true
    },
    "signature": {
      "type": "object",
      "required": ["alg", "key", "value"],
      "properties": {
        "alg": { "const": "ed25519" },
        "key": { "type": "string" },
        "value": { "type": "string" }
      },
      "additionalProperties": true
    },
    "receipt": {
      "type": "object",
      "required": [
        "spec",
        "receipt_id",
        "task_id",
        "issued_at",
        "issuer",
        "type",
        "seq",
        "body",
        "sig"
      ],
      "properties": {
        "spec": { "enum": ["continuity-receipt/0.1", "continuity-receipt/0.2", "continuity-receipt/0.3"] },
        "receipt_id": { "$ref": "#/$defs/urn" },
        "task_id": { "$ref": "#/$defs/urn" },
        "issued_at": { "$ref": "#/$defs/timestamp" },
        "issuer": {
          "type": "object",
          "required": ["kind", "id"],
          "properties": {
            "kind": { "enum": ["gate", "agent", "counterparty"] },
            "id": { "type": "string" }
          },
          "additionalProperties": true
        },
        "type": {
          "enum": [
            "session.pass.created",
            "task.decision",
            "task.execution",
            "delivery.attestation",
            "task.termination",
            "settlement",
            "authority.succession",
            "agreement.offer",
            "agreement.accept"
          ]
        },
        "seq": { "type": "integer", "minimum": 0 },
        "prev": { "type": ["string", "null"] },
        "body": { "type": "object" },
        "sig": { "$ref": "#/$defs/signature" }
      },
      "additionalProperties": true,
      "allOf": [
        {
          "if": { "properties": { "type": { "const": "session.pass.created" } } },
          "then": { "properties": { "body": { "$ref": "#/$defs/body_session_pass" } } }
        },
        {
          "if": { "properties": { "type": { "const": "task.decision" } } },
          "then": { "properties": { "body": { "$ref": "#/$defs/body_decision" } } }
        },
        {
          "if": { "properties": { "type": { "const": "task.execution" } } },
          "then": { "properties": { "body": { "$ref": "#/$defs/body_execution" } } }
        },
        {
          "if": { "properties": { "type": { "const": "delivery.attestation" } } },
          "then": { "properties": { "body": { "$ref": "#/$defs/body_delivery" } } }
        },
        {
          "if": { "properties": { "type": { "const": "task.termination" } } },
          "then": { "properties": { "body": { "$ref": "#/$defs/body_termination" } } }
        },
        {
          "if": { "properties": { "type": { "const": "settlement" } } },
          "then": { "properties": { "body": { "$ref": "#/$defs/body_settlement" } } }
        },
        {
          "if": { "properties": { "type": { "const": "authority.succession" } } },
          "then": { "properties": { "body": { "$ref": "#/$defs/body_succession" } } }
        },
        {
          "if": { "properties": { "type": { "const": "agreement.offer" } } },
          "then": { "properties": { "body": { "$ref": "#/$defs/body_offer" } } }
        },
        {
          "if": { "properties": { "type": { "const": "agreement.accept" } } },
          "then": { "properties": { "body": { "$ref": "#/$defs/body_accept" } } }
        }
      ]
    },
    "body_session_pass": {
      "type": "object",
      "required": [
        "gate_id",
        "mandala_class",
        "quotas",
        "expires_at",
        "policy_version",
        "mandate_ref",
        "agent_id"
      ],
      "properties": {
        "gate_id": { "type": "string" },
        "mandala_class": { "enum": ["gate-lite", "gate-hard"] },
        "quotas": { "type": "object" },
        "expires_at": { "$ref": "#/$defs/timestamp" },
        "policy_version": { "type": "string" },
        "mandate_ref": { "$ref": "#/$defs/hash" },
        "agent_id": { "type": "string" },
        "spend_cap": {
          "type": "object",
          "required": ["minor", "currency"],
          "properties": {
            "minor": { "type": "integer" },
            "currency": { "type": "string" }
          }
        }
      },
      "additionalProperties": true
    },
    "body_decision": {
      "type": "object",
      "required": [
        "action",
        "action_args_hash",
        "model",
        "input_provenance",
        "decision",
        "policy_version"
      ],
      "properties": {
        "action": { "type": "string" },
        "action_args_hash": { "$ref": "#/$defs/hash" },
        "model": { "type": "object" },
        "input_provenance": {
          "type": "object",
          "required": ["observed_sources_hash"],
          "properties": {
            "policy_id": { "type": "string" },
            "allowed_sources": { "type": "array", "items": { "type": "string" } },
            "observed_sources_hash": {
              "type": "string",
              "pattern": "^(sha256:[0-9a-f]{64}|merkle-sha256:[0-9a-f]{64})$"
            }
          },
          "additionalProperties": true
        },
        "decision": { "enum": ["allow", "deny", "require_approval"] },
        "policy_version": { "type": "string" }
      },
      "additionalProperties": true
    },
    "body_execution": {
      "type": "object",
      "required": ["tool_calls", "egress", "resources", "sandbox_class"],
      "properties": {
        "tool_calls": { "type": "array", "items": { "type": "object" } },
        "egress": { "type": "array", "items": { "type": "object" } },
        "resources": { "type": "object" },
        "sandbox_class": { "type": "string" },
        "denials": { "type": "array", "items": { "type": "object" } }
      },
      "additionalProperties": true
    },
    "body_delivery": {
      "type": "object",
      "required": ["request_hash", "response_hash", "counterparty"],
      "properties": {
        "request_hash": { "$ref": "#/$defs/hash" },
        "response_hash": { "$ref": "#/$defs/hash" },
        "counterparty": {
          "type": "object",
          "required": ["id"],
          "properties": {
            "id": { "type": "string" },
            "attestation": { "$ref": "#/$defs/signature" }
          },
          "additionalProperties": true
        },
        "spec_ref": {
          "oneOf": [{ "type": "string" }, { "$ref": "#/$defs/redaction" }]
        },
        "quality_flags": {
          "oneOf": [
            { "type": "array", "items": { "type": "string" } },
            { "$ref": "#/$defs/redaction" }
          ]
        }
      },
      "additionalProperties": true
    },
    "body_termination": {
      "type": "object",
      "required": ["reason", "limits_at_stop", "remaining"],
      "properties": {
        "reason": { "enum": ["completed", "budget_exhausted", "time_expired", "killed", "error"] },
        "limits_at_stop": { "type": "object" },
        "remaining": { "type": "object" },
        "kill_signal": { "enum": ["dharma", "operator", "quota", "aup"] }
      },
      "additionalProperties": true
    },
    "body_settlement": {
      "type": "object",
      "required": ["rail", "rail_ref", "amount", "gated_on_delivery", "settled_at"],
      "properties": {
        "rail": { "enum": ["x402", "invoice", "stripe", "offchain", "none"] },
        "rail_ref": { "type": "string" },
        "amount": {
          "type": "object",
          "required": ["minor", "currency"],
          "properties": {
            "minor": { "type": "integer", "minimum": 0 },
            "currency": { "type": "string" }
          }
        },
        "gated_on_delivery": { "type": "boolean" },
        "settled_at": { "$ref": "#/$defs/timestamp" },
        "dispute_window_s": { "type": "integer", "minimum": 0 }
      },
      "additionalProperties": true
    },
    "body_succession": {
      "type": "object",
      "required": ["from_authority", "to_authority", "effective_at", "reason"],
      "properties": {
        "from_authority": { "type": "string" },
        "to_authority": { "type": "string" },
        "effective_at": { "$ref": "#/$defs/timestamp" },
        "reason": { "enum": ["handoff", "expiry", "operator_change"] }
      },
      "additionalProperties": true
    },
    "body_offer": {
      "type": "object",
      "required": ["offer_id", "offeree", "terms_hash", "valid_until", "nonce"],
      "properties": {
        "offer_id": { "type": "string" },
        "offeree": { "type": "string" },
        "terms_hash": { "$ref": "#/$defs/hash" },
        "terms_ref": {
          "oneOf": [{ "type": "string" }, { "$ref": "#/$defs/redaction" }]
        },
        "valid_until": { "$ref": "#/$defs/timestamp" },
        "nonce": { "type": "string" }
      },
      "additionalProperties": true
    },
    "body_accept": {
      "type": "object",
      "required": ["offer_ref", "offer_id", "terms_hash"],
      "properties": {
        "offer_ref": { "$ref": "#/$defs/hash" },
        "offer_id": { "type": "string" },
        "terms_hash": { "$ref": "#/$defs/hash" }
      },
      "additionalProperties": true
    },
    "anchor": {
      "type": "object",
      "required": ["target", "hash"],
      "properties": {
        "target": { "$ref": "#/$defs/urn" },
        "hash": { "$ref": "#/$defs/hash" },
        "anchor": {
          "type": "object",
          "required": ["type"],
          "properties": {
            "type": { "enum": ["opentimestamps", "public-chain", "custom"] },
            "value": { "type": "string" }
          },
          "additionalProperties": true
        }
      },
      "additionalProperties": true
    },
    "revocation": {
      "type": "object",
      "required": ["key", "revoked_at", "sig"],
      "properties": {
        "key": { "type": "string" },
        "revoked_at": { "$ref": "#/$defs/timestamp" },
        "reason": { "type": "string" },
        "successor_key": { "type": "string" },
        "sig": { "$ref": "#/$defs/signature" }
      },
      "additionalProperties": true
    }
  }
}
