{
  "spec": "continuity-receipt/0.3",
  "task_id": "urn:uuid:01a0cffe-3189-7a2d-b83c-38cafc22f3a7",
  "receipts": [
    {
      "spec": "continuity-receipt/0.3",
      "receipt_id": "urn:uuid:01a0cffe-3189-7e21-8eef-e86e2e7660f7",
      "task_id": "urn:uuid:01a0cffe-3189-7a2d-b83c-38cafc22f3a7",
      "issued_at": "2026-09-23T20:38:57Z",
      "issuer": {
        "kind": "gate",
        "id": "did:key:z6MkwSG2hFkD41K85fvQFtNGCZXYFUwEZDqrzahZvWHt5hm1"
      },
      "type": "session.pass.created",
      "seq": 0,
      "prev": null,
      "body": {
        "gate_id": "gate-lite-1",
        "mandala_class": "gate-lite",
        "quotas": {
          "cpu_ms": 300000,
          "mem_mb": 1024,
          "disk_mb": 512,
          "wall_ms": 300000
        },
        "expires_at": "2026-09-18T00:00:00Z",
        "policy_version": "2026-09-17.1",
        "mandate_ref": "sha256:2b830c309eb818bbfc952afb491e7229a31b05344ae25a96818afc19bfe3b01b",
        "agent_id": "did:key:z6MkqrXa4NxUxGiEsgvPc2pdoP7dArk58nA4YBguVR7igyPS",
        "spend_cap": {
          "minor": 1000,
          "currency": "USD"
        }
      },
      "sig": {
        "alg": "ed25519",
        "key": "did:key:z6MkwSG2hFkD41K85fvQFtNGCZXYFUwEZDqrzahZvWHt5hm1",
        "value": "wGXr6MKIuAOUtJel2OT-mF8vQBN5Z-nEbR8zkOQitYanmsoYc7uPeIuLwx2jltaoyp6p12s1xYukr21epOF4Dw"
      }
    },
    {
      "spec": "continuity-receipt/0.3",
      "receipt_id": "urn:uuid:01a0cffe-3189-772d-a167-005f669cbdc7",
      "task_id": "urn:uuid:01a0cffe-3189-7a2d-b83c-38cafc22f3a7",
      "issued_at": "2026-09-23T20:38:57Z",
      "issuer": {
        "kind": "gate",
        "id": "did:key:z6MkwSG2hFkD41K85fvQFtNGCZXYFUwEZDqrzahZvWHt5hm1"
      },
      "type": "agreement.offer",
      "seq": 1,
      "prev": "sha256:296b98a17fcef2d57b92d0323621900129a0aafd6ae8d1a421e778c08429fc86",
      "body": {
        "offer_id": "offer-1",
        "offeree": "did:key:z6MkiqMhLhuq26ofXDsP6WeDPTm74a27qdqjKSmNvEmnJjSb",
        "terms_hash": "sha256:f5e6fc8a40da814644df94ab98d739a608dff37759b88bc8e730fe62ca700cd4",
        "valid_until": "2030-01-01T00:00:00Z",
        "nonce": "nonce-offer-1",
        "terms_ref": {
          "redacted": true,
          "commit": "sha256:c975ac3525d1bdf24946ec886576e4211e0bdda2b40bf250108af96c2f6fd21b"
        }
      },
      "sig": {
        "alg": "ed25519",
        "key": "did:key:z6MkwSG2hFkD41K85fvQFtNGCZXYFUwEZDqrzahZvWHt5hm1",
        "value": "8UOyZrJivzlttWErEGjtrG7lEjs6MTwVXeQr0HumPIiXmy1FTm4f0TjhJZ-EnxAsLuErMv0CgYQ2COCc_O4XBA"
      }
    },
    {
      "spec": "continuity-receipt/0.3",
      "receipt_id": "urn:uuid:01a0cffe-3189-734e-8496-5c0cfb27b006",
      "task_id": "urn:uuid:01a0cffe-3189-7a2d-b83c-38cafc22f3a7",
      "issued_at": "2026-09-23T20:38:57Z",
      "issuer": {
        "kind": "gate",
        "id": "did:key:z6MkwSG2hFkD41K85fvQFtNGCZXYFUwEZDqrzahZvWHt5hm1"
      },
      "type": "agreement.accept",
      "seq": 2,
      "prev": "sha256:f9e59748b96d799f90b2ebdd338097f0aae0f200d5d7e44309745260dcf2a1ba",
      "body": {
        "offer_ref": "sha256:f9e59748b96d799f90b2ebdd338097f0aae0f200d5d7e44309745260dcf2a1ba",
        "offer_id": "offer-1",
        "terms_hash": "sha256:f5e6fc8a40da814644df94ab98d739a608dff37759b88bc8e730fe62ca700cd4"
      },
      "sig": {
        "alg": "ed25519",
        "key": "did:key:z6MkwSG2hFkD41K85fvQFtNGCZXYFUwEZDqrzahZvWHt5hm1",
        "value": "WaZYh9UNO13ktVobYRqN3xCrXEgkIbMjPR4bPH5Foe-WP4CsAB2sSJIHsV6wOV2yncg9PK-l8tcHoi0V4GzwCw"
      }
    },
    {
      "spec": "continuity-receipt/0.3",
      "receipt_id": "urn:uuid:01a0cffe-3189-7a8b-a049-eee1d4447b51",
      "task_id": "urn:uuid:01a0cffe-3189-7a2d-b83c-38cafc22f3a7",
      "issued_at": "2026-09-23T20:38:57Z",
      "issuer": {
        "kind": "gate",
        "id": "did:key:z6MkwSG2hFkD41K85fvQFtNGCZXYFUwEZDqrzahZvWHt5hm1"
      },
      "type": "task.decision",
      "seq": 3,
      "prev": "sha256:a2d8084b862d27f0dc82c917900f94b01b53af2f1d5559153c71b16db9373732",
      "body": {
        "action": "memory.search",
        "action_args_hash": "sha256:fb916f19b7c02f8f792ca53936138717130a49f9d78d10771f3b9fdec1527e1c",
        "model": {
          "provider": "local",
          "id": "wm-recall"
        },
        "input_provenance": {
          "policy_id": "egress.default",
          "allowed_sources": [
            "gate"
          ],
          "observed_sources_hash": "sha256:32728104f48b39191bbebf63918ab59d820056b90a568dd56bb2b90944109cf0"
        },
        "decision": "allow",
        "policy_version": "2026-09-17.1"
      },
      "sig": {
        "alg": "ed25519",
        "key": "did:key:z6MkwSG2hFkD41K85fvQFtNGCZXYFUwEZDqrzahZvWHt5hm1",
        "value": "gd83pP4YpAS4yve-Bhqr5Rns7_vpjp8yv9g3th282BLoiGZFFtXMiJsETMi-algTD3Mg9zycYef9Vpe2_TjWBA"
      }
    },
    {
      "spec": "continuity-receipt/0.3",
      "receipt_id": "urn:uuid:01a0cffe-318a-7d52-9db3-deebf20d9caa",
      "task_id": "urn:uuid:01a0cffe-3189-7a2d-b83c-38cafc22f3a7",
      "issued_at": "2026-09-23T20:38:57Z",
      "issuer": {
        "kind": "gate",
        "id": "did:key:z6MkwSG2hFkD41K85fvQFtNGCZXYFUwEZDqrzahZvWHt5hm1"
      },
      "type": "task.execution",
      "seq": 4,
      "prev": "sha256:f43315645b8eb2c50f9f29682d065aba1f1778803171da7c234296ee6e98ea40",
      "body": {
        "tool_calls": [
          {
            "name": "memory.search",
            "args_hash": "sha256:fb916f19b7c02f8f792ca53936138717130a49f9d78d10771f3b9fdec1527e1c",
            "result_hash": "sha256:25a5c9e5bc675aa25f13ab52ec21253f6eab8ba1508dac54044540f1e0063500"
          }
        ],
        "egress": [
          {
            "destination": "none",
            "bytes": 0,
            "allowed": true
          }
        ],
        "resources": {
          "cpu_ms": 1200,
          "mem_peak_mb": 48,
          "disk_peak_mb": 8
        },
        "sandbox_class": "bwrap-landlock"
      },
      "sig": {
        "alg": "ed25519",
        "key": "did:key:z6MkwSG2hFkD41K85fvQFtNGCZXYFUwEZDqrzahZvWHt5hm1",
        "value": "fr7OnAr3OeVQPBgyRVZHnM3vr_aKaY_iFB7L03wJ-q-p8f5krHxit3V4kqLihIBCtmRaVP4_B8DXvJF2K8kvCA"
      }
    },
    {
      "spec": "continuity-receipt/0.3",
      "receipt_id": "urn:uuid:01a0cffe-318a-7f6e-9a37-ed0d51289a34",
      "task_id": "urn:uuid:01a0cffe-3189-7a2d-b83c-38cafc22f3a7",
      "issued_at": "2026-09-23T20:38:57Z",
      "issuer": {
        "kind": "gate",
        "id": "did:key:z6MkwSG2hFkD41K85fvQFtNGCZXYFUwEZDqrzahZvWHt5hm1"
      },
      "type": "task.termination",
      "seq": 5,
      "prev": "sha256:9c95e540a9c5d9b73017a982608cfd2f1b5686003ac3c29f734a25525311aa2f",
      "body": {
        "reason": "completed",
        "limits_at_stop": {
          "cpu_ms": 300000,
          "wall_ms": 300000,
          "spend_minor": 1000,
          "currency": "USD"
        },
        "remaining": {
          "cpu_ms": 298800,
          "wall_ms": 299000,
          "spend_minor": 800,
          "currency": "USD"
        }
      },
      "sig": {
        "alg": "ed25519",
        "key": "did:key:z6MkwSG2hFkD41K85fvQFtNGCZXYFUwEZDqrzahZvWHt5hm1",
        "value": "Yh7jwlqqVTPBs_kse6J8-wx9c9aCVK7Eyx5UUj9vN8jjtvp_rN8use7Tymoemin1UN_FOgLfPnu6kUjTCdrgDg"
      }
    }
  ],
  "disclosure_map": {
    "receipts[1].body.terms_ref": {
      "salt": "0b07f0d09ef1e327c9940e8aa8d02178",
      "value": "https://example.com/terms/recall-pilot-1"
    }
  }
}
